{
  "contractVersion": "1.0.0",
  "hostContract": "1.0.0",
  "agent": "review",
  "outcome": {
    "status": "completed",
    "next": "proceed",
    "questions": [],
    "blockers": []
  },
  "artifacts": [".brain/02-features/refunds/04-review.md"],
  "changedFiles": [],
  "payload": {
    "verdict": "changes-requested",
    "findings": [
      {
        "findingId": "finding-window-boundary",
        "severity": "high",
        "summary": "The window comparison excludes the final day.",
        "ref": "src/refunds/window.ts"
      }
    ]
  }
}
