{
  "contractVersion": "1.0.0",
  "hostContract": "1.0.0",
  "agent": "plan",
  "outcome": {
    "status": "completed",
    "next": "proceed",
    "questions": [],
    "blockers": []
  },
  "artifacts": [".brain/02-features/refunds/02-plan.md"],
  "changedFiles": [],
  "payload": {
    "steps": [
      {
        "stepId": "step-window",
        "summary": "Read the refund window from configuration.",
        "dependsOn": []
      },
      {
        "stepId": "step-ledger",
        "summary": "Record every refund against the audit ledger.",
        "dependsOn": ["step-window"]
      }
    ]
  }
}
